{
  "project_name": "Ex Machina",
  "writer": "Alex Garland",
  "draft": "Clean Shooting Script",
  "date": "2013",
  "genre": "Science Fiction / Drama",
  "page_count": 108,
  "script_source": "url",
  "script_url": "https://www.dailyscript.com/scripts/exMachina_script.pdf",
  "notes": "A24/DNA Films production. $15M total budget. VFX by Double Negative (DNEG). Won Academy Award for Best Visual Effects 2016. Story takes place almost entirely in a remote underground research facility — contained location with a single CG character (Ava) as the primary VFX element."
}
